FOODON:00005508	FOODON:00005235	bologna	beef bologna			Bologna that is made from beef.															https://orcid.org/0000-0001-5275-8866	USDA
FOODON:00005509	FOODON:00005236	bologna	chicken bologna			Bologna that is made from chicken meat.																USDA
FOODON:00005510	FOODON:00005237	bologna	pork bologna			Bologna that is made from pork.																USDA
FOODON:00005511	FOODON:00005238	bologna	turkey bologna			Bologna that is made from turkey meat.																USDA
FOODON:00005512	FOODON:00005239	macaroni or noodle food product	beef macaroni			Macaroni that is made from beef.															https://orcid.org/0000-0001-5275-8866	USDA
FOODON:00005513	FOODON:00005240	fruit sauce	guava sauce			A fruit sauce made from guava.															https://orcid.org/0000-0001-5275-8866	USDA
FOODON:00005514	FOODON:00005241	sugar (refined)	sugar (powdered)																		https://orcid.org/0000-0001-5275-8866	USDA
FOODON:00005515	FOODON:00005242	tea (steeped)	green tea (steeped)			Steeped tea made from green tea leaves (Camellia sinensis).															https://orcid.org/0000-0001-5275-8866	USDA
FOODON:00005243		tea (steeped)	black tea (steeped)			Steeped tea made from fully oxidized black tea leaves (Camellia sinensis)															https://orcid.org/0000-0001-5275-8866	USDA
FOODON:00005516	FOODON:00005244	tea (steeped)	hibiscus tea (steeped)			Steeped tea made from dried hibiscus flowers (Hibiscus sabdariffa).															https://orcid.org/0000-0001-5275-8866	USDA
FOODON:00005517	FOODON:00005245	tea (steeped)	oolong tea (steeped)			Steeped tea made from partially oxidized tea leaves (Camellia sinensis). 															https://orcid.org/0000-0001-5275-8866	USDA
FOODON:00005518	FOODON:00005246	tea (decaffeinated) 	black tea (decaffeinated)			Black tea that has most of its caffeine removed through a decaffeination process, while preserving its flavor, aroma, and other characteristic properties.																USDA
FOODON:00005444		tea (decaffeinated) 	green tea (decaffeinated)			Green tea that has most of its caffeine removed through a decaffeination process, while preserving its flavor, aroma, and other characteristic properties.																
FOODON:00005519	FOODON:00005247	tea (dry, instant)	lemon tea (dry, instant)			"A beverage mix that quickly dissolves in hot or cold water to create a lemon-flavoured tea.
OR 
A beverage prepared by dissolving an instant mix in hot or cold water to create a lemon-flavored drink."																USDA
FOODON:00005520	FOODON:00005248	soybean flour	soybean flour (full fat)			A soybean flour that is made from whole soybeans, retaining all of the natural oils, which gives it a higher fat content.																USDA
FOODON:00005521	FOODON:00005249	soybean flour	soybean flour (low fat)			A soybean flour made from whole soybeans that has been processed to reduce its natural oil content.																USDA
	FOODON:00005250	flour| sesame food product	sesame flour DUPLICATE			A flour that is made by grinding defatted sesame seeds after oil extraction.																USDA
FOODON:00005523	FOODON:00005251	flour	acorn flour			A flour that is made by grinding acorns, the nuts of oak trees, after they have been properly processed to remove tannin.																USDA
FOODON:00005524	FOODON:00005252	animal protein supplement	whey protein isolate			A refined form of whey protein, processed to remove most of the fat and lactose, resulting in a higher protein content. 																USDA
FOODON:00005525	FOODON:00005253	bratwurst	chicken bratwurst			Bratwurst that is made from chicken meat.																USDA
FOODON:00005526	FOODON:00005254	bratwurst	pork bratwurst			Bratwurst that is made from pork.																USDA
FOODON:00005527	FOODON:00005255	bratwurst	veal bratwurst			Bratwurst that is made from veal.																USDA
FOODON:00005528	FOODON:00005256	wheat pasta food product	whole wheat pasta			Pasta made from whole wheat flour that retains the bran, germ, and endosperm of the wheat grain.																USDA
FOODON:00005529	FOODON:00005257	white corn flour	whole grain white corn flour			Flour made from the whole kernels of white corn (Zea mays), which includes the bran, germ, and endosperm.																USDA
FOODON:00005530	FOODON:00005258	white cornmeal	whole grain white cornmeal			Cornmeal made from whole white corn kernels (Zea mays), which includes the bran, germ, and endosperm																USDA
FOODON:00005531	FOODON:00005259	"bacon (whole cut or pieces)|turkey meat food product
"	turkey bacon			A bacon made from turkey meat.																USDA
FOODON:00005532	FOODON:00005260	milled durum wheat 	couscous			A dish made from durum wheat semolina, which is moistened and rolled into small granules, then steamed or boiled. 																USDA
FOODON:00005533	FOODON:00005261	turkey sausage	turkey sausage (raw)			A turkey sausage that is raw.																USDA
FOODON:00005534	FOODON:00005262	salami	beef salami			Salami made from beef.																USDA
FOODON:00005535	FOODON:00005263	salami	turkey salami			Salami made from turkey meat.																USDA
FOODON:00005536	FOODON:00005264	salami	pork salami			Salami made from pork meat.																USDA
FOODON:00005537	FOODON:00005265	patty	chicken patty			A patty made from chicken meat.																USDA
FOODON:00005538	FOODON:00005266	salmon food product	salmon nugget			A nugget made from salmon meat that is often breaded or battered and typically fried or baked.																USDA
FOODON:00005539	FOODON:00005267	tofu	soft tofu			A tofu that has a smooth, delicate texture and high moisture content																USDA
FOODON:00005540	FOODON:00005268	tofu	firm tofu			A tofu that has a denser texture with lower moisture content, allowing it to hold its shape well during cooking.																USDA
FOODON:00005541	FOODON:00005269	tofu	silken tofu			A tofu that has a creamy, smooth texture and high moisture content.																USDA
FOODON:00005542	FOODON:00005270	silken tofu	silken soft tofu			A tofu that has an ultra-creamy texture and high moisture content.																USDA
FOODON:00005543	FOODON:00005271	silken tofu	silken firm tofu			A tofu that has a creamy texture while being slightly firmer, making it versatile for both savory and sweet dishes that require shape retention.																USDA
FOODON:00005544	FOODON:00005272	silken tofu	super firm tofu			 A tofu that has minimal moisture and an extremely dense texture, ideal for grilling, frying, or baking while maintaining its shape.																USDA
FOODON:00005545	FOODON:00005273	silken tofu	silken extra firm tofu			A tofu that has a denser texture while retaining some creaminess.																USDA
FOODON:00005546	FOODON:00005274	silken tofu	silken lite firm tofu			 A tofu that has a lighter texture with reduced fat content, providing a balance of creaminess and firmness																USDA
FOODON:00005547	FOODON:00005275	silken tofu	silken lite extra firm tofu			A tofu that has the densest texture with reduced fat.																USDA
FOODON:00005548	FOODON:00005276	carob food product	Carob flour			A flour made from ground carob pod, which is the dried fruit of the carob tree (Ceratonia siliqua).																USDA
FOODON:00005549	FOODON:00005277	fruit powder	baobab powder			A powder made from the dried fruit pulp of the baobab tree (Adansonia spp).																USDA
FOODON:00005550	FOODON:00005278	fruit juice (liquid)	tart cherry juice			A fruit juice made from tart cherry.																USDA
	FOODON:00005279	pork meat food product	pork headcheese DUPLICATE OF pork head cheese			Headcheese made from pork.																USDA
FOODON:00005552	FOODON:00005280	fruit puree	raspberry puree			A puree made from raspberry.																USDA
FOODON:00005553	FOODON:00005281	bran cereal	oat bran cereal			A cereal that is made from the outer layer of the oat grain (the bran), which is separated from the endosperm and germ.																USDA
FOODON:00005554	FOODON:00005282	pastrami	turkey pastrami			Pastrami that is made from turkey meat																USDA
FOODON:00005555	FOODON:00005283	noodle	rice noodle			Noodles that are made from rice.																USDA
FOODON:00005556	FOODON:00005284	cornmeal	whole grain cornmeal			Cornmeal that is made by grinding the whole corn kernel, including the bran, germ, and endosperm.																
FOODON:00005557	FOODON:00005285	whole grain cornmeal|yellow cornmeal	whole grain yellow cornmeal			Cornmeal that is made by grinding the whole yellow corn kernel, including the bran, germ, and endosperm.																USDA
FOODON:00005558	FOODON:00005286	wheat cereal	wheat germ cereal			Wheat cereal made from the germ of the wheat kernel, which is the part of the grain that can sprout into a new wheat plant.																USDA
FOODON:00005559	FOODON:00005287	breakfast cereal (whole grain)|wheat cereal	whole wheat cereal			Breakfast cereal that is made from whole wheat grains that include all parts of the grain—the bran, germ, and endosperm.																USDA
FOODON:00005560	FOODON:00005288	pork sausage	pork sausage link			A pork sausage made from ground pork mixed with spices and seasonings, encased in a natural or synthetic casing to form individual cylindrical links.																USDA
FOODON:00005561	FOODON:00005289	pork sausage	pork sausage patty			A pork sausage made from ground pork mixed with spices and seasonings, formed into a flat, round disc shape without the use of a casing.																USDA
FOODON:00005562	FOODON:00005290	rice cereal food product	cream of rice			A finely ground rice cereal food product, that can be cooked with water or milk to form a smooth, creamy cereal. 																USDA
FOODON:00005563	FOODON:00005291	wheat cereal food product	cream of wheat			A finely ground wheat cereal food product, specifically farina, that is cooked with water or milk to create a smooth and creamy porridge. 																USDA
FOODON:00005564	FOODON:00005292	puffed rice cereal	puffed rice cereal (fortified)			Puffed rice cereal that has been fortified to enhance its nutritional value.																USDA
FOODON:00005565	FOODON:00005293	puffed wheat cereal	puffed wheat cereal (fortified)			Puffed wheat cereal that has been fortified to enhance its nutritional value.																USDA
	FOODON:00005294	sunflower food product	sunflower seed butter DUPLICATE			A seed butter that is made from ground sunflower seeds.																USDA
FOODON:00005567	FOODON:00005295	noodle	cellophane noodle			Noodle that is made from starch, typically mung bean or sweet potato starch, that becomes soft and transparent when cooked. 	https://en.wikipedia.org/wiki/Cellophane_noodles					glass noodle|chinese cellophane noodle|fensi						They are called "cellophane noodles" or "glass noodles" due to their transparent, glass-like appearance.				USDA
FOODON:00005568	FOODON:00005296	common oat cereal food product 	quick oats			Whole oat groats that are pre-cooked, dried, and then rolled into thinner flakes to reduce cooking time																USDA
FOODON:00005569	FOODON:00005297	quick oats	quick oats (with iron)			Quick oats that have been fortified with added iron. 																USDA
FOODON:00005570	FOODON:00005298	beef sausage	lebanon bologna			A type of beef sausage that is cured, smoked, and fermented semi dry, originating from Lebanon County, Pennsylvania.	https://en.wikipedia.org/wiki/Lebanon_bologna															USDA
FOODON:00005571	FOODON:00005299	hominy grits	white hominy grits			Hominy grits made from white corn that has undergone nixtamalization, a process involving soaking and cooking the corn in an alkaline solution to remove the hull and soften the kernels.																USDA
FOODON:00005572	FOODON:00005300	processed pork meat food product	pork liver cheese			Liver cheese that is made primarily from ground pork liver.																USDA
FOODON:00005573	FOODON:00005301	cereal grain food product	cereal grain beverage			A drink made from processed cereal grains, such as wheat, rice, barley, or oats, often combined with water, flavorings, and sweeteners.																USDA
FOODON:00005574	FOODON:00005302	cereal grain beverage	cereal grain-based coffee substitute			A beverage made from roasted cereal grains that is intended to be used as an alternative to coffee.																USDA
FOODON:00005575	FOODON:00005303	coffee beverage	espresso			A coffee beverage brewed by forcing hot water under high pressure through finely-ground coffee beans.																USDA
FOODON:00005576	FOODON:00005304	espresso	"espresso (decaffeinated)
"			An espresso coffee made using coffee beans from which most of the caffeine has been removed. 																
FOODON:00005577	FOODON:00005305	soy protein isolate	soy protein isolate (potassium fortified)			A soy protein isolate that has been fortified with potassium, to enhance its mineral content while providing a high concentration of protein.																USDA
FOODON:00005578	FOODON:00005306	soy protein	soy protein concentrate			A concentrated soy protein product derived from whole soybeans, containing approximately 70% protein. It is produced by partially removing fats and carbohydrates while retaining some natural nutrients and fiber, making it suitable for various food applications.																USDA
FOODON:00005579	FOODON:00005307	cow whey	acid whey			A byproduct of cheese production, specifically from the manufacturing of soft cheeses, such as cottage cheese or cream cheese. It is characterized by a lower pH and higher acidity.	https://en.wikipedia.org/wiki/Whey					sour whey										USDA
FOODON:00005580	FOODON:00005308	cow whey	sweet whey			A byproduct of cheese production, primarily from the manufacturing of hard cheeses, such as cheddar or gouda.	https://en.wikipedia.org/wiki/Whey															USDA
FOODON:00005445		stew	moose stew			A stew made from moose meat.																
FOODON:00005446		stew	acorn stew			A stew made from acorn.																
FOODON:00005447		stew	corn stew			A stew made from corn.																
FOODON:00005448		bread	tennis bread			A type of bread that is often sweetened with ingredients like sugar, butter, and cinnamon, and may include additional flavorings such as dried fruit or nuts. 																
FOODON:00005449		coconut food product	coconut water			The naturally occurring liquid extracted from a young, green coconut.																
FOODON:00005581	FOODON:00005410	water (bottled)	non-carbonated water (bottled)			Water that is bottled without the addition of carbon dioxide, making it still and free of bubbles or fizz																
FOODON:00005582	FOODON:00005411	butter	butter (light)			A butter with reduced fat content, made by adding water, air, or non-fat milk solids.																
FOODON:00005583	FOODON:00005412	gourd food product	Kanpyo			The dried shavings of Lagenaria siceraria var. hispida, a variety of calabash gourd.																
FOODON:00005584	FOODON:00005413	head cheese	pork head cheese			Headcheese made from pork.																
FOODON:00005585	FOODON:00005414	meat spread|liver food product	liverwurst spread			A meat spread made from liver, typically from pork or beef, combined with fat, spices, and other seasonings to create a smooth, spreadable product.																
FOODON:00005586	FOODON:00005415	peanut food product|flour	peanut flour			A flour made from crushed, fully or partly defatted peanuts.																
FOODON:00005587	FOODON:00005416	syrup	malt syrup		 	A syrup made from malted barley or grains.																
FOODON:00005588	FOODON:00005417	pork meat food product	pork loaf			A blend of pork, fat, and spices, pressed into a loaf shape.																
FOODON:00005589	FOODON:00005418	dietary supplement, amino acid or protein	soy-based protein powder			A plant-based protein supplement what is derived from soybeans.																
FOODON:00005590	FOODON:00005419	dietary supplement, amino acid or protein	whey-based protein powder			 A protein supplement made from whey, the liquid byproduct that is separated during the process of making cheese from milk.																
FOODON:00005591	FOODON:00005420	ham food product	ham			Pork hind leg, cured, smoked or cooked. 																
FOODON:00005592	FOODON:00005421	ham food product|ham	ham patty			A patty made from ground or finely chopped ham.																
FOODON:00005593	FOODON:00005422	ham food product|animal steak	ham steak			An animal steak that comes from the hind leg of the pig (the ham).																
FOODON:00005594	FOODON:00005423	pork cured meat food product	pork breakfast strip			A thin slice of pork that is specifically prepared for breakfast.																
FOODON:00005595		berry juice	chilchen			A beverage that is made from red berries.																
				food (canned)' and 'derives from' some [part of plant or animal]																		
FOODON:03301003		pineapple food product	pineapple (canned)	'food (canned)' and 'derives from' some pineapple						pineapple												
FOODON:03301085		shrimp food product	shrimp (canned)	'food (canned)' and 'derives from' some shrimp				shrimp														
FOODON:03301087		salmon food product	salmon (canned)	food (canned)' and 'derives from' some salmon				salmon														
FOODON:03301151		mussel food product	mussel (canned)	food (canned)' and 'derives from' some mussel				mussel														
FOODON:03301155		clam food product	clam (canned)	food (canned)' and 'derives from' some clam				clam														
FOODON:03301165		albacore food product	albacore (canned)	food (canned)' and 'derives from' some albacore				albacore														