Ontology ID	parent class	label	definition	definition source	comment	logical axiom	English syn.	British english syn.	Italian syn.	French syn.	german syn.	spanish syn.	portuguese syn.	see also	cross reference	term editor	class type	curation status	image	Curation notes
FOODON:00002612	red wine	Syrah wine	Syrah wine is a white wine produced entirely from Syrah grapes.  The wines are often powerfully flavoured and full-bodied.	https://en.wikipedia.org/wiki/Syrah#Shiraz_wines		'derives from' some 'Syrah grape plant'										Ginny Pichler	subclass	IAO:0000122	https://upload.wikimedia.org/wikipedia/commons/thumb/8/8e/Walla_walla_Syrah.jpg/179px-Walla_walla_Syrah.jpg	
FOODON:00002613	Vitis vinifera	Syrah grape plant	Syrah is a dark-skinned grape variety grown throughout the world and used primarily to produce red wine. In 1999, Syrah was found to be the offspring of two obscure grapes from southeastern France, Dureza and Mondeuse Blanche.	https://en.wikipedia.org/wiki/Syrah			Shiraz									Ginny Pichler	subclass	IAO:0000122	https://upload.wikimedia.org/wikipedia/commons/thumb/e/eb/Shiraz_Grapes.jpg/320px-Shiraz_Grapes.jpg	
																		IAO:0000122		
FOODON:00002614	red wine	Tempranillo wine	Tempranillo wine is a red wine varietal produced entirely from Tempranillo grapes.	https://en.wikipedia.org/wiki/Tempranillo		'derives from' some 'Tempranillo grape plant'										http://orcid.org/0000-0002-8844-9165	subclass	IAO:0000122		
FOODON:00002615	Vitis vinifera	Tempranillo grape plant	Tempranillo is a black grape variety widely grown to make full-bodied red wines in its native Spain.	https://en.wikipedia.org/wiki/Tempranillo								Ull de Llebre | Cencibel | Tinta del Pais	Aragonez | Tinta Roriz			http://orcid.org/0000-0002-8844-9165	subclass	IAO:0000122		
																		IAO:0000122		
FOODON:00002617	red wine	Zinfandel wine	Zinfandel wine is a red wine varietal produced entirely from Zinfandel grapes.  A classic wine is high in both alcohol and tannins, intensely flavored and deeply colored.	https://www.wine-searcher.com/grape-391-primitivo		'derives from' some 'Zinfandel grape plant'										Ginny Pichler	subclass	IAO:0000122		
FOODON:00002618	Vitis vinifera	Zinfandel grape plant	Zinfandel is a variety of black-skinned wine grape.	https://en.wikipedia.org/wiki/Zinfandel			Primitivo									Ginny Pichler	subclass	IAO:0000122	https://upload.wikimedia.org/wikipedia/commons/f/fc/Zinfandel_grapes.jpg	
																		IAO:0000122		
FOODON:00002619	red wine	Frappato wine	Frappato wine is a red wine varietal produced entirely from Frappato grapes.  As a varietal, Frappato produces light bodied wines with a distinct grapey aroma.	https://en.wikipedia.org/wiki/Frappato		'derives from' some 'Frappato grape plant'			Frappato Nero | Frappato Nero di Vittoria | Frappatu | Frappatu di Vittoria | Nerello| Nerello di Catania | Nero Capitano.							http://orcid.org/0000-0002-8844-9165	subclass	IAO:0000122		
FOODON:00002620	Vitis vinifera	Frappato grape plant	Frappato di Vittoria or Frappato is a red Italian wine grape variety planted primarily in Sicily.	https://en.wikipedia.org/wiki/Frappato					Frappato di Vittoria							http://orcid.org/0000-0002-8844-9165	subclass	IAO:0000122		
																		IAO:0000122		
FOODON:00002621	red wine	Gamay noir wine	Gamay noir wine is a red wine varietal produced entirely from Gamay grapes.	https://en.wikipedia.org/wiki/Gamay		'derives from' some 'Gamay grape plant'										http://orcid.org/0000-0002-8844-9165	subclass	IAO:0000122		
FOODON:00002622	Vitis vinifera	Gamay grape plant	Gamay is a purple-colored grape variety used to make red wines, most notably grown in Beaujolais and in the Loire Valley around Tours.	https://en.wikipedia.org/wiki/Gamay						Gamay Noir à Jus Blanc						http://orcid.org/0000-0002-8844-9165	subclass	IAO:0000122	https://upload.wikimedia.org/wikipedia/commons/3/38/Gamay.jpg	
																		IAO:0000122		
FOODON:00002623	white wine	Gewürztraminer wine	Gewürztraminerwine is a white wine varietal produced entirely from Gewürztraminer grapes.	https://en.wikipedia.org/wiki/Gew%C3%BCrztraminer		'derives from' some 'Gewürztraminer grape plant'										http://orcid.org/0000-0002-8844-9165	subclass	IAO:0000122		
FOODON:00002624	Vitis vinifera	Gewürztraminer grape plant	Gewürztraminer is an aromatic wine grape variety, used in white wines, and performs best in cooler climates.	https://en.wikipedia.org/wiki/Gew%C3%BCrztraminer			Gewürz			Gewurztraminer						http://orcid.org/0000-0002-8844-9165	subclass	IAO:0000122	https://upload.wikimedia.org/wikipedia/en/thumb/1/11/Gewurztraminer_-_raisins_sur_pied_de_vigne.jpg/320px-Gewurztraminer_-_raisins_sur_pied_de_vigne.jpg	
																		IAO:0000122		
FOODON:00002625	red wine	Carignane wine	Carignane wine is a red wine varietal produced entirely from Carignane grapes.	https://en.wikipedia.org/wiki/Carignan		'derives from' some 'Carignane grape plant'										http://orcid.org/0000-0002-8844-9165	subclass	IAO:0000122		
FOODON:00002626	Vitis vinifera	Carignane grape plant	Carignan (also known as Carignane) is a red grape variety of Spanish origin that is more commonly found in French wine but is widely planted throughout the western Mediterranean and around the globe.	https://en.wikipedia.org/wiki/Carignan					Carignano | Bovale Grande			Cariñena | Mazuelo | Samsó | Carinyena				http://orcid.org/0000-0002-8844-9165	subclass	IAO:0000122	https://upload.wikimedia.org/wikipedia/commons/thumb/7/77/Carignan_Viala_et_Vermorel.jpg/415px-Carignan_Viala_et_Vermorel.jpg	
																		IAO:0000122		
FOODON:00002627	red wine	Grenache wine	Grenache wine is a red wine varietal produced entirely from Grenache grapes.	https://en.wikipedia.org/wiki/Grenache		'derives from' some 'Grenache grape plant'										http://orcid.org/0000-0002-8844-9165	subclass	IAO:0000122		
FOODON:00002628	Vitis vinifera	Grenache grape plant	Grenache is one of the most widely planted red wine grape varieties in the world.	https://en.wikipedia.org/wiki/Grenache								Garnacha				http://orcid.org/0000-0002-8844-9165	subclass	IAO:0000122	https://upload.wikimedia.org/wikipedia/commons/thumb/b/bd/Grenache_N.jpg/440px-Grenache_N.jpg	
																		IAO:0000122		
FOODON:00002629	red wine	Barbera wine	Barbera wine is a red wine varietal produced entirely from Barbera grapes.	https://en.wikipedia.org/wiki/Barbera		'derives from' some 'Barbera grape plant'										http://orcid.org/0000-0002-8844-9165	subclass	IAO:0000122		
FOODON:00002630	Vitis vinifera	Barbera grape plant	Barbera is a red Italian wine grape variety that, as of 2000, was the third most-planted red grape variety in Italy (after Sangiovese and Montepulciano). It produces good yields and is known for deep color, full body, low tannins and high levels of acid.	https://en.wikipedia.org/wiki/Barbera												http://orcid.org/0000-0002-8844-9165	subclass	IAO:0000122		
FOODON:00002863	Vitis vinifera	Blaufränkisch grape plant	Blaufränkisch (German for blue Frankish) is a dark-skinned variety of grape used for red wine.	https://en.wikipedia.org/wiki/Blaufr%C3%A4nkisch							Blaufränkisch grape|lemberger | Blauer Limberger | Blue Limberger					http://orcid.org/0000-0002-8844-9165	subclass	IAO:0000122		
FOODON:00002864	red wine	Blaufränkisch wine	A red wine varietal produced entirely from Blaufränkisch grapes.	https://en.wikipedia.org/wiki/Blaufr%C3%A4nkisch		'derives from' some 'Blaufränkisch grape plant'										http://orcid.org/0000-0002-8844-9165	subclass	IAO:0000122		
FOODON:00002868	Vitis vinifera	Mourvèdre grape plant	A red wine grape plant variety that is grown in many regions around the world including the Rhône and Provence regions of France, the Valencia and Jumilla denominaciones de origen of Spain, as well as the Balearic Islands, California and Washington and the Australian regions of South Australia and New South Wales, as well as South Africa.	https://en.wikipedia.org/wiki/Mourv%C3%A8dre			Mourvèdre grape | Mataró | Monastrell					Monastrell				http://orcid.org/0000-0002-8844-9165	subclass	IAO:0000122	https://upload.wikimedia.org/wikipedia/commons/thumb/c/c6/Balzac_noir-mourvedre.jpg/451px-Balzac_noir-mourvedre.jpg	
FOODON:00002869	red wine	Mourvèdre wine		https://en.wikipedia.org/wiki/Mourv%C3%A8dre		'derives from' some 'Mourvèdre grape plant'										http://orcid.org/0000-0002-8844-9165	subclass	IAO:0000122		
																				
FOODON:00004045	grape extract	pressed grape juice	Grape juice which is extracted from grapes using a grape pressing process.	https://en.wikipedia.org/wiki/Pressing_(wine)#Free-run_versus_pressed_juice	Pressed juice often has lower acidity levels, higher potassium and pH level, more phenolic compounds such as tannins and more suspended solids such as natural gum and proteins. [wikipedia:Pressing_(wine)#Free-run_versus_pressed_juice]															
FOODON:00004044	grape extract	free-run grape juice	Grape juice which has been extracted through the process of crushing, the natural break down of the grape cell walls during maceration or fermentation, and/or by the weight of grapes within a tall container.	https://en.wikipedia.org/wiki/Pressing_(wine)#Free-run_versus_pressed_juice																
FOODON:00004046	grape extract	grape pomace	The solid remains of grapes after crushing or pressing, typically containing pulp, skins, stems, and seeds.	https://en.wikipedia.org/wiki/Pomace	"Grape pomace contains the skins, pulp, seeds, and stems of the fruit, and has traditionally been used to produce pomace brandy."     [https://en.wikipedia.org/wiki/Pomace]		marc | grape solids													
FOODON:00001071	grape extract	grape must	A grape berry food product which is the juice of freshly pressed grapes that contains some amount of pulp, skins, stems, and seeds.	https://en.wikipedia.org/wiki/Must#Winemaking	Grape pomace components typically comprises between 7 to 23 percent of the total weight of must. [https://en.wikipedia.org/wiki/Must]															
FOODON:00004039	grape must	destemmed grape must	A grape berry food product which results from crushing whole (destemmed) grapes and which contains grape juice and components of grape pomace.																	
FOODON:00004051	grape must	red wine must	A grape must made from red wine grapes which are substantially macerated.	https://en.wikipedia.org/wiki/Maceration_(wine)		'is specified output of' some ('extended maceration' and 'has specified input' some 'red grape cluster')														
FOODON:00004052	grape must	white wine must	A grape must made from red or white wine grapes and which has insignificant masceration.	https://en.wikipedia.org/wiki/Maceration_(wine)																
FOODON:00004050	grape must	rosé wine must	A grape must made from red wine grapes which are partially macerated.	https://en.wikipedia.org/wiki/Maceration_(wine)		'is specified output of' some ('limited maceration' and 'has specified input' some 'red grape cluster')														
																				